{"case_id":"case-d832ff5d2ad4","competing_explanations":[{"explanation_id":"explanation-1","statement":"Local-intensity thresholding creates a small number of sharply separated field_b hotspots; concentrating a fixed pulse dose into a smaller radius should therefore strengthen later spatial gradients."},{"explanation_id":"explanation-2","statement":"Interface-length recruitment creates the heterogeneity; spreading the same dose over a larger radius supplies a longer active perimeter and should therefore strengthen later spatial gradients."}],"decisive_experiment":{"controlled_variables":"Compare radii 1 and 4 under fixed total dose per pulse. Hold initialization, grid, reflecting boundary, pulse timing, control settings, sampling schedule, run length, and any seed schedule fixed; change no other design variable and perform no post-observation fitting.","design_family":"pulse_radius_at_fixed_total_dose","level_a":1.0,"level_b":4.0,"opposing_predictions":[{"explanation_id":"explanation-1","rationale":"At fixed dose, radius 1 concentrates exposure and more readily crosses a local threshold, producing sharper persistent field_b contrasts at t48 than radius 4.","relation":"a_greater_than_b"},{"explanation_id":"explanation-2","rationale":"If recruitment is controlled by active-interface extent, radius 4 provides the longer perimeter and produces greater field_b gradient energy at t48 than radius 1.","relation":"a_less_than_b"}],"response_feature":"gradient_energy","response_field":"field_b","response_time":48},"empirical_surprise":"At t36, field_b is much more dispersed than predicted (standard deviation 0.365885 versus 0.283932; standardized residual +1.639) yet has fewer high-valued sites (high fraction 0.250000 versus 0.333333; -1.667). Its gradient energy is also elevated (0.044342 versus 0.034578; +0.976), while its mean differs only modestly (0.331275 versus 0.310232; +0.421). This joint signature indicates unexpectedly concentrated spatial structure rather than a uniform level shift.","evidence_cell_ids":["field_b-t36-standard_deviation","field_b-t36-high_fraction","field_b-t36-gradient_energy","field_b-t36-mean"],"literature_queries":["fixed-dose spatial pulse radius local intensity threshold gradient persistence","interface length versus local concentration in pulsed two-field spatial dynamics","high variance low exceedance fraction localized spatial hotspots"],"prior_art_risk":"Threshold concentration and interface recruitment are individually established generic mechanisms, so a broad mechanism claim may lack novelty. The lower-risk contribution is the frozen, opposing fixed-dose radius prediction tied to this specific joint numerical signature.","research_question":"Is the unexpectedly high dispersion and gradient energy but low high-valued fraction of field_b at t36 caused by local-intensity thresholding or by interface-length recruitment?","schema_version":1,"scientific_payoff":"The fixed-dose radius contrast separates two causal geometries that both explain the existing snapshot but require opposite outcomes. A directional result identifies whether local concentration or exposed perimeter governs persistence, determining which intervention geometry deserves further study without refitting the reference explanation.","stop_rule":"Classify the predeclared field_b t48 gradient-energy contrast using a numerical tolerance fixed before execution. Radius 1 greater than radius 4 retains explanation-1; radius 1 less than radius 4 retains explanation-2. If they are approximately equal, reject radius-mediated geometry as the driver and redirect the next study to temporal persistence using pulse_lag rather than refining either explanation."}