{"case_id":"case-d832ff5d2ad4","competing_explanations":[{"explanation_id":"explanation-1","statement":"The t36 mismatch reflects persistent fine-scale spatial memory: concentrated pulses leave interfaces that raise field_b dispersion and gradient energy while limiting the area reaching the high threshold."},{"explanation_id":"explanation-2","statement":"The mismatch is a global transient-phase error: field_b is caught in a broad intermediate-value phase, producing higher dispersion but fewer threshold exceedances, and the phase depends on total dose rather than pulse footprint."}],"decisive_experiment":{"controlled_variables":"Compare pulse radii 1 and 4 while holding total dose per pulse, pulse times, initial condition, boundary, grid, control settings, sampling schedule, and run length fixed; make no post-observation adjustments.","design_family":"pulse_radius_at_fixed_total_dose","level_a":1,"level_b":4,"opposing_predictions":[{"explanation_id":"explanation-1","rationale":"At fixed dose, the compact radius should preserve sharper, longer-lived interfaces, yielding greater field_b gradient energy at t60 than the diffuse radius.","relation":"a_greater_than_b"},{"explanation_id":"explanation-2","rationale":"If the anomaly is a total-dose-controlled phase mismatch, redistributing the same dose spatially should leave late field_b gradient energy approximately unchanged.","relation":"approximately_equal"}],"response_feature":"gradient_energy","response_field":"field_b","response_time":60},"empirical_surprise":"At t36, field_b standard deviation is 0.365885 versus 0.283932 predicted (+1.639 standardized residual; field_b-t36-standard_deviation), while high_fraction is 0.25 versus 0.333333 predicted (-1.667; field_b-t36-high_fraction). This opposing pair is stronger than the concurrent mean mismatch (+0.421; field_b-t36-mean), while elevated gradient energy (+0.976; field_b-t36-gradient_energy) specifically suggests unresolved spatial structure.","evidence_cell_ids":["field_b-t36-standard_deviation","field_b-t36-high_fraction","field_b-t36-gradient_energy","field_b-t36-mean"],"literature_queries":["fixed-total-dose localized pulse radius persistent spatial gradient energy two-field dynamics","discordant variance and threshold exceedance transient spatial fields hidden-state memory"],"prior_art_risk":"Moderate: generic footprint-dependent persistence and transient threshold effects may be known, but the discriminating claim is the signed late gradient-energy contrast at fixed total dose, not either mechanism in isolation.","research_question":"Does the discordant t36 field_b pattern—excess dispersion and gradient energy but deficient high-threshold area—arise from persistent sensitivity to pulse footprint rather than a total-dose-controlled transient phase?","schema_version":1,"scientific_payoff":"A positive signed contrast would identify spatial footprint as a causal state variable missing from the frozen state-free explanation. Approximate equality would instead prioritize temporal-phase mechanisms and rule out further footprint-focused refinement.","stop_rule":"Pre-register the radius-1 minus radius-4 contrast in field_b gradient energy at t60. Continue the footprint-memory question only if it is positive beyond machine-level repeatability; if it is approximately zero or negative, reject that direction and redirect the next study to temporal-phase interventions without fitting parameters to this result."}